Authors,Title & Publication,Date,Summary,Summary,Method,Category,Country,Link
"
Yueling Huang",The Labor Market Impact of Artificial Intelligence: Evidence from US Regions,Sept 2024,Pre chatGPT: data from 2010-2021 Finds larger decline in epop ratio in commuting zones with higher AI adoption Effect mainly in manufacturing and low skilled serviced sectors and young+old employees. Worse for men than women ,"• Examines labor impact of AI in the U.S. from 2010 to 2021 by exploiting regional variation in AI adoption.
• Areas with higher AI adoption experienced larger declines in employment-to-population ratio, with the decline beying disproportionately borne by low-skill services and manufacturing sectors, non-STEM workers, men, young and old workers.",Quasi-Experimental,Employment Impact (Pre-LLM),US,https://www.imf.org/en/Publications/WP/Issues/2024/09/13/The-Labor-Market-Impact-of-Artificial-Intelligence-Evidence-from-US-Regions-554845
"Ole Teutloff, Johanna Einsiedler, Otto Kässi, Fabian Braesemann, Pamela Mishkin, & R. Maria del Rio-Chanona",Winners and losers of generative AI: Early Evidence of Shifts in Freelancer Demand,July 2025,LLM-based clustering shows 10% of job postings are substitutable by GenAI. • GenAI cut demand for substitutable skill clusters by up to 50% in short-term roles. • Demand for some complementary AI clusters like machine learning increased. • Demand for novice workers in complementary roles declined. • Aggregate freelance demand did not decrease after the ChatGPT launch.,"• Uses data from a leading freelancing platform to categorize skills as substitutable, complementary, or unaffected by LLMs. Concludes that about 10% of job postings on the platform are for substitutable skills.
• Finds that after the release of ChatGPT, labor demand rose for  complementary and unaffected skills, and declined by 20-50% relative to trend for substitutable skills, such as writing and translation.
• Although complementary skills saw overall increased demand, some elements declined. Demand for ML programming grew by 24% relative to trend, demand for chatbot development tripled, while demand for novice workers fell overall.",Quasi-Experimental,Employment Impact,US,https://www.sciencedirect.com/science/article/pii/S0167268124004591
"R. Maria del Rio-Chanona, Ekkehard Ernst, Rossana Merola, Daniel Samaan, Ole Teutloff","AI and Jobs: A review of theory, estimates, and evidence",Sept 2025,"Meta analysis of RCTs, field experiments, and other data. New classification of task complexity. Bigger productivity gains in RCTs than field experiments. Mild evidence of declining demand for junior workers in writing/translation. Bigger declease in novice jobs in AI complementary work from surveys/admin data. Lit gaps include limited types of LLMs used, tech centric AI exposure measures and variance, use of simple tasks","• Surveys a wide range of studies of AI impact on productivity to find that productivity gains vary heavily based on context. Gains are 20-60% in RCTs, 15-30% in field experiments.
• In simple tasks, novice workers seem to benefit the most. In more complex tasks, evidence is mixed on whether novice or experienced workers benefit more.
• In writing and translation tasks, digital trace data show rising demand for AI and substitution of machines for humans, along with mild evidence of declining demand for novice workers.
• The most recent studies show more substantial declines in demand for novice workers in AI complementary jobs.",Meta-analysis,Productivity Impact,US,https://arxiv.org/pdf/2509.15265
Guy Lichtinger & Seyed Hosseini,Generative AI as Seniority-Biased Technological Change: Evidence from U.S. Résumé and Job Posting Data,Sept 2025,"Following GenAI adoption, junior employment declines sharply in adopting firms relative to non-adopters, while senior employment remains largely unchanged. The junior decline is concentrated in occupations most exposed to GenAI and is driven by slower hiring rather than increased separations or promotions.","• Using private data sets from Linkedin and Revelio Labs to track firm-level employment by seniority from 2015 to 2025, and cross-check with generative AI adoption, as measured by whether a firm hires for an ""AI integrator"" to implement or operate AI in its work.
• Find that in firms that hire AI integrators, employment for junior workers in AI exposed roles declines sharply relative to non adoptors. Senior employment doesn't change. The junior decline is driven by reduced hiring, not greater firing.",Descriptive,Employment Impact,US,https://papers.ssrn.com/sol3/papers.cfm?abstract_id=5425555
"Dirk Czarnitzki,  Gastón P. Fernández, & Christian Rammer",Artificial intelligence and firm-level productivity,July 2023,German firms: positive and significant associations between the use of AI and firm productivity,"• Looks at the effect of AI adoption in German firms in 2022 (pre LLM era), finding significant positive impact on productivity.",Quasi-Experimental,Employment Impact (Pre-LLM),Germany,https://www.sciencedirect.com/science/article/pii/S0167268123001531
Samuel Muehlemann ,AI Adoption and Workplace Training (IZA working paper),Oct 2024,"2019-2021 data, AI adoption reduces the provision of continuing training for incumbent workers while increasing the share of high-skilled new hires and decreasing medium-skilled hires, thereby contributing to skill polarization. However, AI adoption also increases the number of apprenticeship contracts, particularly in small and medium-sized enterprises (SMEs).","• Looks at AI adoption in German firms from 2019 to 2021, finding that adoption reduced training for new workers, increased the share of high-skilled hires, reduced the share of medium-skilled hires, and increased the number of apprenticeship contracts.",Quasi-Experimental,Productivity Impact,Germany,"https://docs.iza.org/dp17367.pdf#:~:text=thereby%20contributing%20to%20skill%20polarization,to%20apply%20AI%20in%20production"
Mark A. Chen & Joanna Wang,Displacement or Augmentation? The Effects of AI Innovation on Workforce Dynamics and Firm Value ,May 2025,"2007-2023 US patent data: AI innovations related to high-level cognition (i.e., language, decision-making, engagement, learning, or creativity) augment human labor, while those related to low-level cognition (i.e., perception or motor control) displace it.","• Uses data on AI related patents in the US from 2007 to 2023.
• AI innovations related to high-level cognition (i.e., language, decision-making, engagement, learning, or creativity) augmented human labor, while those related to low-level cognition (i.e., perception or motor control) displace it.",Quasi-Experimental,Employment Impact (Pre-LLM),US,https://papers.ssrn.com/sol3/papers.cfm?abstract_id=5246388
,,,,,,,,
,,,,,,,,
